,Time,User,Tweet,Location,Retweets
,,,"Never rely on these guys for anything, they keep changing their forecast and outlooks because they have absolutely NO clue.They're more of a political body rather than a weather/climate body.Their main concern is to push the global warming/climate change narrative."
,,,"Feedback loops make climate action even more urgent, scientists say: Researchers have identified global warming accelerators known as amplifying feedback loops that the researchers say aren't being properly included in climate models. They note th.."
,,,"""It's unarguable that man-made global warming is real and we are facing a climate emergency"" (Judge Wilkinson). What a pillock."
,,,"Dangerous climate feedback loops areincreasing global warmingand risk causing a permanent shift away from the Earths current climate, according to a new study."
,,,Most of the people on this planet &amp; even the judicial system in the UK recognise that man-made global warming is real &amp; we are facing a climate emergency. And yet our leaders wrecklessly ignore the science &amp; knowingly jeopardise our future by granting more fossil fuel projects
,,,George McInerney finds this interesting Climate: Lessons from the latest global warming
,,,The great cities are in great threat in age city shouldnt be here
,,,"I wonder if those leftist geniuses are aware that China is THE BIGGEST polluter in the world followed by India? Since they equate ""climate change"" with global warming and pollution shouldn't they be harassing the Chinese?"
,,,"Dangerous climate feedback loops are increasing global warming and risk causing a permanent shift away from the Earths current climate, according to a new study"
,,,"Is this a legitimate claim?""We know that once emissions of greenhouse gases go to zero, global warming will stop within a year or twoProf James Renwick ://"
,,,Whatever It Takes Both poles are icebound with heat confined to the tropics. There is no global warming or climate emergency.
,,,Exxon knowingly sabotaged the world for decades. Oil company drove some of the leading science of the era only to publicly dismiss global warming.
,,,"I was stating this + year satellite record is the true gold standard measurement of global temperatures. You need &gt; years of data to start inferring climate, rather than weather, issues. The satellite record indicates next to NO warming. Thats the UNs crisis - games up!"
,,,Its not global warming silly. This is debunked. Its climate change now.
,,,A few more of these to cool the planet down will fix global warming. No need for Green Wash'n Climate Change taxes and marketing fund raising bs.
,,,"I cant help it if your reaction is fear.Why are you showing U.S. when its global warming, and the USA only covers % of the globe? Oh, bc you follow U.S climate denial sitesRegardless, USA is also warming. Both raw &amp; adjusted (more accurate) data to up."
,,,There is no point pushing the climate agenda until you are willing to take on China and India. The rest of the world going net will have no bearing on global warming.
,,,"The conference of parties (cop) of the united nations framework convention on climate change unites around people from countries. It is aimed at limiting global warming to below degrees celsius above pre-industrial levels, with"
,,,I hope Global warming will change this. Canada is one of the few countries that stands to benefit from a warmer climate.
,,,"It's like the people who scream the loudest about ""global warming"" and ""climate change"" actually WANT to destroy the earth."
,,,"It might seem counterintuitive, but global warming plays a role in blasts of bitter cold weather. The reason: It influences the jet stream. Heres how."
,,,Climate Change Activists Begin Untested Procedure Pumping Chemicals Into the Atmosphere to Stop Global Warming via
,,,Its understandable that people are concerned when they see these barriers being installed all over the UK and articles like this about potential climate lockdowns from an environmental publication. /
,,,"Greta Thunberg, Al Gore, Bill Gates, WEF, Klaus Schwab, Paris Accord members, Barack Obama, Hillary Clinton, Democratic Party &amp; Climate Crisis/Global Warming/Environmental Activists are silent on Ohio Chernobyl Nuke like explosion?"
,,,".President said Kenya will be hosting a climate summit in September this year, to underline the Government s commitment to protecting the country from the adverse effects of global warming."
,,,"Raymond Pierrehumbert, a professor of physics at Oxford University, told CNN.Soros also called on the World Bankwhose former president, David Malpass, was accused of denying climate changeto increase international funding to combat rising global warming."
,,,How good is Global Warming The world has warmed degree C in the last years. Climate death rate has fallen % over the last century. IF we get another degrees C of warmingItll be a little warmer &amp; lot greener
,,,Global Warming / climate change = perpetual lies for monetary and political gains
,,,"You need to Google ""Climate change explained simply for mongs"".Global warming is real and humans caused it."
,,,"Totally understandable. I would never move there. Anyway, with global warming, New York is the new climate capital of the US of A. / s Stay safe, and ... Your kids always come first!If you come to the Apple, wed love to meet up. And my wife is even nicer than I am!"
,,,Climate lessons from the last global warming via
,,,Acceleration of global sea level rise imminent past planetary warming IBS Center for Climate Physics
,,,"bud in the s we were head for a new ice age, by the mid s it was global warming and now its climate change. The weather clowns cant even get a day forecast right."
,,,"Global Warming eh, what a bugger, Oh no, sorry it isn't Global Warming anymore is it because they lost that argument it's Climate Change now which still ISN'T happening just more difficult to prove because the Eco Mentalists keep moving the Goalposts."
,,,"""Its abundantly clear that you are all good people. You are intelligent, articulate and a pleasure to deal with. Its unarguable that man-made global warming is real and we are facing a climate emergency. Your aims are admirable""DEAL WITH IT"
,,,"Global warming isnt real. Our global climate has always been changing, but for some reason a bunch of people think its static.Please explain how a scientist determined that despite our climate changing for millions of years, the universe somehow got it right in the s."
,,,"Climate change, global warming.whatever.same difference"
,,,"Don't forget what else he said:""Its unarguable that man-made global warming is real and we are facing a climate emergency."""
,,,"Global warming is having a major impact on our food system. Rising temperatures, droughts and extreme weather events are putting stress on crops &amp; reducing yields. It's time to take action with to combat climate change and create a more sustainable, resilient food system."
,,,"Gary, I've found that % of the people who believe man made cGlobal warming is going to destroy the earth know none of the facts around how climate works or the history of climate on earth."
,,,Which were wrong?
,,,"Dangerous climate feedback loops are increasing global warming and risk causing a permanent shift away from the Earths current climate, according to a new study.Of these, they found that are driving up global temperatures, according to the study published Friday in the"
,,,"/The same acronym monsters that use their fake crisis ""global warming"" errrrr ""climate change"" as an excuse to diminish our prosperity while lining crony pocketsTry to diminish this real crisis b/c they are at fault for the mismanagement if not the cause of the disaster"
,,,"Im just curious, in college are they taught how to research or just talked to repeat? Climate crisis is not our common thread. Anybody looking at the SCIENCE knows the common thread is removing power of the top controllers of world economies FOR PROFIT FOR WARMING THE PLANET"
,,,"Just like the climate scam: In , the predicted In , the predicted all islands of the Maldives would drown between and due to ""global warming."" The islands have expanded since then."
,,,why your hashtag global warming was switched to hashtag climate change?Global warming was debunkedChange the name all you want but if smells like **** it probably is s***
,,,"A new United Nations report discusses how is compounding the century-old drug-resistance problem, which is a pressing issue that will continue to affect for years to come. More from :"
,,,": How to Deal with Climate Change, Global Warming - CNBC"
,,,Global warming isn't a thing anymore It's climate catastrophe Please download the new update
,,,Weather Geo Engineering is already in use by the Globalist to destroy our planet &amp; genocide. They have been caught using it to promote &amp; support there fraud climate change agenda. Weather war has been in use for decades. Climate change is man made.
,,,"None should believe in global warming, the planet is actually cooling and climate change happens naturally every years, whether humans are here or not. Wake up, World."
,,,"Researchers have identified global warming accelerators, known as amplifying feedback loops. Many aren't being properly included in climate models."
,,,"Anticipating ever-greater change impacts, some see as bringing significant change to collective ."
,,,Cant wait for it to snow once in mid-March and the climate change deniers crawl out of the woodwork to say that global warming is fake.
,,,"George Soros calls for weather control to stop global warming, ice sheet melting We aren't smart enough to control the weather! We should be smart enough to adapt to the natural climate changes that take place on our planet though!"
,,,"Climate change is pole shifting... Nothing more, we in Canada have no control on the rest of the world only provide education moving forward on how to deal with garbage in the ocean. Global warming will happen matter how many money you throwing at it."
,,,"Whenever we talk about sustainable development, I always tell the world to witness the tribal lifestyle in India which has answers to climate change and global warming. - PM ://"
,,,"Climate change: UK has been too slow to tackle global warming, watchdog warns"
,,,The same people who decided the term global warming didn't work anymore so they pivoted to climate change are now trying to tell you that sex change surgery should now be called gender-affirming surgery. But you're smarter than that.
,,,"Yes, we have to overcome the spiral of self destruction by evolving a systems mindset to guarantee future biodiversity.I am reading THE CLIMATE BOOK where different authors underline t. necessity of waking up to Global Warming."
,,,"Umm....Climate Change/Global Warming, screw those who are ignorant &amp; think otherwise. Meanwhile, here in Arizona, it's cooler than that! More ppl, especially the meteorologists, need to realize this is real &amp; not always be like ""Enjoy this beautiful, warm weather!"""
,,,Face it. Extreme weather due to global warming. It's the climate crisis.
,,,Need concentration on climate change and global warming by united nations and take must concrete and meaningful step for the same. Ocean becoming danger due to increasing their levels fast. India should warn to all countries.
,,,"""We've done terrible things to our climate. Let's monkey around with it some more, shall we?"""
,,,"As increasingly severe floods, droughts and wildfires take their toll worldwide, the onus is on businesses of every size and sector to adapt to the very real consequences of global warming"
,,,"Dangerous climate feedback loops are increasing global warming and risk causing a permanent shift away from the Earths current climate, according to a new study."
,,,New Research: Effects of high night temperature on soybean yield and compositions: IntroductionSoybean is sensitive to light and temperature. Under the background of global asymmetric climate warming.MethodsThe increase of
,,,"Britain's coastal towns could be at serious risk if the climate crisis isn't solved over the next years, according to experts. Climate scientists have warned that due to global warming, ice sheets will melt and the sea could engulf some of London's commuter towns and even"
,,,The world has lost its mind when a judge tells a group of stop oil hippies who caused widespread chaos You are intelligent a pleasure to deal with &amp; It's unarguable that man-made global warming is real and we are facing a climate emergency.
,,,"Global warming is climate change. Climate change can be either global cooling or global warming.And to answer your question, no, because you're picking where to trust experts on the environment when experts are telling us climate change will negatively impact our environment."
,,,CHanGE founder and faculty is quoted in this article on climate change and temperatures both and : Will global warming make temperature less deadly?
,,,"/ Due to global warming, flood-like water outbursts from ice-dammed glacial lakes worldwide happen earlier in the year and originate from higher areas. At"
,,,Scientists Examine Dangerous Global Warming Accelerators
,,,"It was ""Global Warming"" prior to that, the fear was global cooling, now, it's 'climate change'. Is the climate changing? Yes. It has always changed. But over millennia. To argue that anthropomorphic CO production has anything to do with it is delusional."
,,,Greenpeace cofounder Dr. Patrick Moore wrote in that there is no scientific proof of the global-warming hypothesis and that alarmist predictions are preposterous.
,,,What % of the change from land bridge to English Channel was because of global warming?
,,,"With this seminar, experts discuss the negative effects of climate change and how they're trying to combat these issues through their research."
,,,"Climate ""scientist:"" ""Computer, tell us global warming is real""Computer: ""Global warming is real"""
,,,"Ten degrees celsius. Summertime. It should be around at this time in the morning. What do we do? Please advise us Greta, the global warming is not working. The dam climate is once again unpredictable and doing its own thing. We need a new doom!"
,,,"Can someone provide an action to mitigate global warming (sorry, climate change) that doesn't increase government power? I refuse to spend gazillion dollars or sacrifice my liberty for a chancy minuscule improvement."
,,,"George Soros calls for weather control to stop global warming, ice sheet meltingJacks opinion: This Climate Crisis screed is a scam and there is no threat of significant global warming, oceans rising and massive melts! Soros is wrong!"
,,,Rubbish... There is no climate crisis nor earth core warming nor cooling.. its all propaganda to an Elitist program
,,,"Look. First this on no way explains the recent rapid GLOBAL heating. Second, AMO is an artifact of CO warming."
,,,"You cannot stop climate change. It's an inevitable part of nature. If what they mean is that they have an idea to stop man made Global Warming - well - I have an idea about how to do that, and it's free - stop believing in it. That's all there is to it."
,,,"Judge Wilkinson: ""It's unarguable that man-made global warming is real and we are facing a climate emergency.""It IS arguable. Otherwise people wouldn't be offering alternative arguments."
,,,WORLD CHANGING WILDFIRES: A new study shows that dangerous climate feedback loops are increasing global warming and risk causing a permanent shift away from the Earth's current climate.
,,,"If this -mile-long ""doomsday glacier"" in West Antarctica collapses, it could bring about a catastrophic rise in sea levels."
,,,"Feedback loops set up self-perpetuating cycles that further intensify the climate crisis. For example, in the Arctic: Rapid warming melts sea ice Exposed water absorbs heat More sea ice loss Read more in a new study from :"
,,,"But, no money for cleanup on isle Palestine, Ohio from the people so, concerned about global cooling, global warming oh, wait now they call it climate change! Environmental disaster who cares but, defending where they launder their $$$$"
,,,"Global warming, Climate Change: Gaia hypothesis."
,,,"Both heat and cold can kill. But cold is far more deadly. For every death linked to heat, nine are tied to cold. Will global warming make temperature less deadly?Where more people will die and live because of hotter temperatures"
,,,I wonder if there is a way to determine the contribution Republican Hot Air is making to global warming and climate change.
,,,"At know point did i say global warming and climate change was bollocks. Just been listening to the same ""bollocks"" that hasnt happened for over years. Meanwhile children are mining youre materials for a ""greater future for future children"""
,,,Global cooling=global warming=climate. Ok. Da sCiEnCe evOlvEs. Chromosomes used to be science.
,,,Damn that global warming/climate change.
,,,"GHG emissions are at a record high, and the goal to limit global warming to below C has become challenging, if not unattainable.Against this backdrop, panelists at the Bund Summit discussed challenges facing global climate investment and finance."
,,,"Via on malaria spread due global warming: UCLAs said humans tend reduce the impacts of climate change down to the world just generally getting warmer, &amp; we dont often think about the vastly interconnected world in which we live."
,,,What climate change due to carbon emissions a socialist produced crisis science can not justify global warming
,,,"We know the ocean has taken up % of the heat caused by anthropogenic global warming. The question is, what dynamics could unexpectedly occur as a result of that rising stress?"
,,,"They divert attention to ""climate change"" and ""global warming"", when the real threat is contamination. They are poisoning our air, water, food, and soil with harmful chemicals. China is the top exporter, while many are forbidden there. And there funds go as per Paris Agreement."
,,,"No it isn't. Climate change (through global warming) is the most pressing environmental issue we face, and denying thermodynamics is silly."
,,,Ah bless ya. So do you believe in global warming or global cooling?
,,,But. But. Global warming. Or is it advancing icecaps? Fvck it. Lets use climate change.
,,,"Due to global warming and pollution, coral reefs are suffering the worst bleaching with the highest dying record since ."
,,,CLIMATE ALARMIST JOHN KERRYS FAMILY WAS SOLD A PRIVATE JET..LOOKS like hes REALLY ALARMED BY HIS GLOBAL WARMING SCHEME
,,,Scientists Examine Dangerous Global Warming Accelerators - Inside Climate News
,,,"Outstandinglong overdue. Global warming, EV etc are all Leftwing scams/grifts. Why are BP, Shell, and Exxon suddenly backing off their climate promises? - Grist"
,,,"plastic fan? Plastic for sure has it uses but it contributes a lot to global warming and climate change issues so no, I am not a fan!loser"
,,,It is simply impossible for CO to have an impact on the climate on a HO planet.. % of the atmosphere is CO.. The doomsday cult went from global warming to 'climate change' for a reason.
,,,Worth a read--another discussion of the
,,,Please explain how % of the atmosphere is causing global warming? You know there's a reason why the doomsday cult went from 'global warming' to 'climate change' right..?
,,,"""How can the world forge the cooperation needed to manage climate change? Most answers to that question hinge on the challenge of enforcement. It is easy to dream up bold agreements but hard to make them stick."""
,,,"I wasn't when the BP spill happened, I was when we went form global warming then we're gonna freeze, then we're going to melt again, and now just climate change which is both depending on where u live.And yes, they were amazed at how fast the microbes devoured the oil"
,,,"'with huge consequences for human rights and citizens daily lives, then the world should trial climate lockdowns, a completely new and untested concept in science, to counter global warming."
,,,The Democrat plans to use the committee gavel to probe ways climate change could threaten the overall economy and how the fossil fuel industry has allegedly misled the public about global warming. But he faces a couple of big obstacles.
,,,current climate models may underestimate some of the effects of global warming because they fail to take full account of the role of amplifying feedback loops
,,,"Recent climate projections may be underestimating the pace of global warming in an atmosphere damaged by greenhouse gas emissions, because the interaction of powerful climate feedback loops that can .."
,,,"...Pittsburgh to Fort Lauderdale. While global warming has catastrophic connotations attached to it, climate change suggests a more controllable and less emotional challenge. Frank Luntz (Republican political strategist)"
,,,"Also, Its time for us to start talking about climate change instead of global warming and conservation instead of preservation. Climate change is less frightening than global warming. As one focus group participant noted, climate change sounds like youre going from..."
,,,"An international collaboration led by scientists including has identified global warming accelerators (amplifying feedback loops), adding urgency to the need to respond to the climate crisis."
,,,"Every fraction of a degree of warming matters, and the effects on daily life will only get worse as the temperature rises. That is why under the Paris Climate Agreement, world governments committed to keeping global warming below degrees Celsius."
,,,Anytime someone talks about a mean global temperature anomaly show them this plot that puts it in context of the natural variability of temperatures on the planet at any given time. It's a statistical trick to zoom in on the last bit of warming and exaggerate the scale.
,,,"I'm not concerned about the climate, as there is no climate crisis.It's through knowledge, not ignorance.A lead NASA scientist M Mann &amp; others, removed the Medieval Warm Period from data, as it was c warmer then.He made the past colder, to make it look like it's warming now"
,,,"The throws another round into their 'culture war' cannon while ignoring inflation, warming climate, competition with China, and their own 'immigration crisis'"
,,,Its collapse could result in catastrophic sea level rise.
,,,JC: Enhanced ENSO-Unrelated Summer Variability in the IndoWestern Pacific under Global Warming
,,,*sighs*How long can we keep denying global warming?Are Climate Deaths Really Down % from a Century Ago? | ://
,,,"HEY Left Coast Drama Club BubbleBoy,What's opinion on the Rail disaster in Ohio and the environmental disaster and the Shit response of Biden.What about Biden blowing up the natural gas pipeline leading to an epic environmental disaster?Global warming or Climate change my ass."
,,,"And it WON'T ""lower world temperatures."" At best, AT BEST, it will slightly slow the natural rate of global warming that began years ago. And that's AT BEST (which is probably far too optimistic). Climate change isn't a hoax, but the ""solutions"" certainly are."
,,,"Climate scientists say some dangerous global warming accelerators may be underestimated. Different climate feedback loops that amplify warming could feed each other, driving more warming than expected by ."
,,,Drought + FloodsClimate research team : Global warming is expected to enhance drought extremes in the US throughout the twenty-first century via
,,,Will global warming make temperature less deadly?
,,,Myth-buster: Why two degrees of global warming is worse than it sounds Yale Climate Connections
,,,Scientists Examine Dangerous Global Warming 'Accelerators': Inside Climate News MORE w/ EcoSearch:
,,,The fight against climate change will not particularly benefit from the gigantic profits that the world's largest oil companies have made in
,,,"Dangerous climate feedback loops are increasing global warming and risk causing a permanent shift away from the Earth's current climate, according to a new study."
,,,"New England is a climate hot spot, warming faster than the global average. In this winter that never was, wildflowers are blooming months early &amp; ticks are thriving says Richard Primack of IGS &amp; , who studies natural ecosystems."
,,,"yes, this administration is really trying to push the envelop of medicine and science. look what they accomplished, they/them, she/her, he/him, identified as this and that? non-binary, plurality, climate change coz global warming didn't pan out, what else?"
,,,"He said Kenya will be hosting a climate summit in September this year, to underline the Government s commitment to protecting the country from the adverse effects of global warming."
,,,"But climate change is a made up thing. In The s it was global cooling, s the ozone, s global warming. All have been proven incorrect or repaired (ozone) so now they take the climate change moniker and every time there is a hurricane, humans are to blame."
,,,"It's starting to look like global warming will transform the ""forever,"" reported in ."
,,,"'s led to a global bleaching of , against the backdrop of world oceans reaching record heat content nearly every year."
,,,And yet all the climate alarmists aren't willing to give any of it up. I encourage you if you believe in global warming to get rid of every thing you own made with oil or shipped with oil. Be the change.
,,,And they have tried to link car crashes to climate change: Feds Ask: Will Global Warming Cause More Deadly Car Crashes?
,,,Global Warming Or Reversal Of A Cooling Trend? Study Sheds Light On Climate Change
