,Time,User,Tweet,Location,Retweets
,,,"Climate change can be a hot winter, a cold summer, tropical trees growing in New York. But global warming is heat."
,,,"The climatistas still chirping about global warming (as many still do ignorantly), that makes them a climatista. But most paid professional climatistas no longer use global warming......they're now using 'climate change', hence they're still climatistas."
,,,"""Conversely, global warming before industrialization challenges proxy-based reconstructions of past climate."" That's not a conundrum that's a refutation. So running the models in times before doesn't match the actual records. Even with all the numbers the model fails."
,,,"Can recharge at those charging stations? Just curious if sharing is caring of if it's exclusive. -'There is no competition among electric cars because global warming concern to all of us, united we all fight against climate change'-"
,,,A suggestion: study up on climate science so that you can gain an appreciation of the difference between global warming and regional/local cooling.
,,,"So you talk about global warming, you claim CO causes warming, you post a graph of CO and a graph of warming, you mention the IPCC, you tell me to ""eyeball it"", but your intent was not to show CO causes warming?Hysterical."
,,,"Its all that acid rain, ozone hole, global warming, and my personal favourite, climate change thats making dongs longer."
,,,Global warming refers to the general planetary trend...Climate change refers to how this can make our environment more chaotic.
,,,"Climate change could mean any change in climate, such as global warming, but global warming means only heat. There is an absolute difference."
,,,"A bought &amp; paid for tool for the then GoreBull Warming, then Climate Change, then Climate Crisis, now Climate Catastrophe crowd. Shell say what shes paid to say &amp; do it all with a manufactured scowl &amp; a gritty, condescending, How DARE you?!?!"
,,,They both lead to the same things...Increase warming around the globe leads to more climate change. The reason why it is more often referred to as climate change is because of the fact that 'global warming' some times give the wrong impression.
,,,"Global warming is a natural phenomenon, before the ice age, the earth was warmer than it is now, all that is happening is the planet is returning to its original climate. No emergency, just another excuse to to fleece people of money."
,,,B. Zhang: Exploring the SST pattern effect on climate feedback and climate sensitivity in GFDL modelsJ Feng: How a stable Longwave feedback is maintained under global warming?D Hartmann: The Antarctic ozone hole and the pattern effect on climate sensitivity/
,,,Check out this article:
,,,No self responsible scientist would ever deny climate change. That's why the scammers and liars changed global warming to climate change. Only halfwits would look out of their windows and claim a climate emergency
,,,"Im talking about global warming, not climate change."
,,,"Global warming will save lives in cold places while killing people in hot ones. Great piece on a complex topic often left to climate deniers. It's like how adding CO increases plant growth, but not enough to outweigh drought &amp; heat stress."
,,,"world needs to learn from tribal societys lifestyle to fight against global challenges like climate challenge, global warming and other pressing issues: PM Modi. via NaMo App"
,,,"Good one! And virtually everything the Climate Believers believe about the effects of Global Warming is backwards. Getting this RIGHT is actually relatively easy and simple -- as simple as ""hot air rises."""
,,,"world needs to learn from tribal societys lifestyle to fight against global challenges like climate challenge, global warming and other pressing issues: PM Modi.via NaMo App"
,,,"There are several natural archives that record changes in the climate over time. The growth rings that form each year in trees, stalagmites and corals can be used to reconstruct past temperature"
,,,as you sit down always remember one thing we need public participation and awareness of the climate change and global warming factor the time is now before the global challenge affect us
,,,"Biden/Harris administration/their Air Space Intel not only incompetent &amp; a Natl Security risks,they keep on wasting taxpayerslike blowing up a $ hobby balloon with a taxpayer funded $K missile spreading cancerous environmental global warming climate crisis causing debris"
,,,The Peoples Party of Canada: ISSUEThe Liberal government is spending billions of dollars at home and abroad to fight global warmingor climate change as it is now called to account for every natural weather event and its opposite.* See PPC Platform for Facts and Solution
,,,"For sure there are many unknowns and details to debate in climate science. But around the basic hypothesis of anthropogenic global warming, no, the science is definitive. It's happening and it's man-made."
,,,Always use Tineye to check the source of the graphs CC deniers use. used a graph by Robert Rohde - who wrote - Much of my work on wiki has been related to climate change/global warming.
,,,There is no man made global warming. Same rate of warming since the last ice age. But heybits just science it will change long before the climate.
,,,No wonder the WEF solution to Global Warming and Climate Change is Population Reduction
,,,"A judge has told seven lawbreakers: ""It's unarguable that man-made global warming is real and we are facing a climate emergency. No-one can criticise your motivations. You are good people and I will not issue a punitive sentence."" Political crime is crime."
,,,"She is the State Religion we are supporting with $Billions. The fake Climate Cult buying BS from their false profits of Al Gore, John Kerry &amp; AOC. NOAA stated we have exceeded years of zero Global Warming, Hurricanes have decreased by % &amp; Pilar bear population increased."
,,,LINKS TO CLIMATE CHANGE
,,,"Did you know that global aviation is responsible for % of net anthropogenic warming and that this figure could triple by ?On March , we are organizing with , an event on climate neutrality in the aviation sector.Register here:"
,,,Thanks for being one of the few Boston or Providence media to connect the dots to global warming! But disappointing to see so many folks who talk climate on Twitter or in once-a-year specials fail to do so on days like this.
,,,"Palestine Ohio:Re: climate change which the use to call global warming!Its all BS.Fact, if we had times the co in the air that we have now it would be better for us and the planet. Trees and grass that give us oxygen would be healthier.If climate change were an issue"
,,,"I'm gonna say it...Climate Change/Global Warming/Global Cooling, whatever they are calling it today, is a FARCE! The climate is constantly changing, but for any man to think that we can control it, is ridiculous!This is about MONEY AND CONTROL, PERIOD!"
,,,"In , global warming will exceed degrees Celsius, according to AI. The new analysis uses neural networks trained on widely used global climate model outputs."
,,,"It is. Full stop. Its absolutely nothing to do with climate change formally known as global warming cos that was a scam too. Its only about money and only ever is. Climate change is a scam, quicker you realise the better."
,,,"I have lived thru the ozone depletion scam in the s, global freezing scam in the s, global warming scam in the s. leaders got rich.and advocates are still being taken advantage of."
,,,"Are you too busy to help fight ?In my Yatra over the last days, I've met a lot of people from all walks of life. And the one thing I've noticed is that the busiest people are the biggest contributors to global warming and climate change."
,,,"You seem a tad triggered, and confused about CO impacts on gse."
,,,"BREAKING: scientists claim that gas powered cars and stoves pose a new existential threat worse than Global Cooling, Warming, or Climate Change. It is ""Global Seasonal Change"" and requires immediate federal regulation.~New Platty Press (""All the Fake News Unfit to Print"")"
,,,"Grifters Unite!Declaration of ENRON insider U.S. VP Al Gores focus on Global Warming provided Enron Chairman Kenneth Lays opportunity to introduce, climate change"" polices that promote our products and services (ENRON WINDs products)"
,,,As evidenced by all of science and by the fact they had to change the name twice. The imminent ice ageGlobal warming Climate changeNext: Weather Patterns (TM)
,,,"First it was Global Warming until they found the earth is cooling, so now its Climate Change. Just a bunch of nut cases"
,,,Global warming/climate change is the Biggest scam in world history
,,,"Anthropogenic, global warming is a hoax. Look for yourself about how much carbon dioxide there is how much we produce. The whole thing is thermodynamic nonsense."
,,,"Today, most citizens of rich countries will know something, however imprecisely, about climate change; many people in India or Nigeria may not even have heard of it. The conceptual framework of global warming accentuates this disparity. Shashank Kela in:"
,,,Climate change which means changes to temperature both ways. The term global warming seems to be confusing you
,,,"And the call goes out yet again about a foot and a half rise by . The Thwaites Glacier dubbed the doomsday glacier because scientists estimate that without it and its supporting ice shelves, sea levels could rise more than to feet."
,,,"""Call it a different kind of dangerous 'climate change': a political climate in which global warming is now joining racism and LGBTQ issues as under fire by culture warriors who dont want young minds exposed to debate around such ideas."""
,,,"This is why for President is a must.He wouldve taken care of the people in E.Palestine,Ohio the victims of the Biden/Harriss Secretary of Transportation Pete Buttigiegs Chernobyl Nuke like disaster/cancerous environmental global warming climate crisis risks"
,,,"These demons can control the weather with ultra high powered electronic frequencies via a machine called HAARP found in Alaska.This is why we see massive climate changes,snow in the summer &amp;heat in the winter,but we r blamed nd being charged in the name global warming"
,,,Global warming/ climate change has to be the greatest con in the history of mankind.
,,,"No one has died because average global temperature has increased slightly since industrialization.In fact, emissions and warming (and the two are not related) have taken global population from billion to billion in the past years."
,,,Climate mitigation is a complex task that requires a combination of different strategies and technologies. It's crucial to take action now to reduce greenhouse gas emissions and slow the rate of global warming.
,,,". Geoengineering: This refers to a variety of technologies that are being developed to manipulate the Earth's climate to counteract the effects of global warming, such as injecting sulfur dioxide into the upper atmosphere to reflect more sunlight back into space."
,,,"Climate change is one of the most pressing global issues of our time, and it requires immediate action to mitigate its effects. Step into the world of climate change mitigation and discover the cutting-edge strategies and tech that are being developed to combat global warming"
,,,"FROM RIGHT NOWIt's CRUCIAL TV Weathermen &amp; MeteorologistsDAILY NOTEThe Global Warming Record Breaking changes in the Weather &amp; Temperatures,Up OR Down,to WARN the Public, on EVERY CONTINENT of Earth,how severely Climate Change may effect EVERYONE in coming years!"
,,,"the global warming hoax isnt the issue, its if an EMP by the Chinese or Russians go off above us (like via a weather balloon)."
,,,Climate lessons from the last global warming
,,,"What the VP means is youre being brainwashed in gov schools to believe climate change can be fixed by humans. . Al Gore was wrong, they changed it from global warming bc that was wrong, ESG is a joke"
,,,"In other words Climate change, global warming, greta thunberg,Are all Bullsht"
,,,"Yes. Please explain climate crisis! First it was global cooling, then global warming, now its become a catch all ""climate crisis"". Unlike men, the climate has periods (of global warming AND cooling)."
,,,I love temperatures from - in February. I embrace global warming and now refuse to recycle. Sorry to that flower or insect that becomes extinct because of climate change but its not always about you!
,,,"Saying things for years, regardless of who says it, does not make it so. That is not how science works. How did we go from cooling, to global warming, to climate change, to severe weather events? What changed? A quick review of past weather events shows no discernable pattern."
,,,It is effect of global warming...very bad climate..
,,,"Global average temps also peaked in , right about when they rebranded ""GLoBal WaRmiNg"" to ""CliMaTE ChAnGe"", so they were covered no matter what."
,,,The same people pushing climate changes used to call it global warming. Take one guess why they changed it. BECAUSE THE EARTH ISN'T HEATING UP. WHAT SUPER CORPORATE SCIENTISTS BILL NYE DIDNT TELL YOU THIS? - on predictions
,,,"Until next week, start-ups can apply to the fifth edition of the Global Warming Mitigation Projects which recognizes start-ups in Africa and the rest of the world for their green solutions in the mobility, finance, and energy sectors."
,,,"With the rising awareness of climate change and global warming, its easy to dismiss those who believe its all a hoax.But conspiracy theories have a way of simmering under the surface, waiting for the right moment. And in the end, they always float back up. /"
,,,"This is how the Liberals prove global warming, climate change, or whatever the hell they call it."
,,,"The repairs and infrastructure investments required to fix leaks from the and gas industry would not only reduce global warming, but they would also generate profits for producers."
,,,", :Updated consensus: % of world scientists believe in manmade global warming!"
,,,"If Canada is responsible for less the two percent of global emissions, how are you going to stop global warming? Without China and India, there can be no change in the trend. Why dont you tell the truth, this is a tax plan not a climate plan!"
,,,"as humanity responds to global warming, renewable, zero-carbon sources of energy, especially wind and solar energy, are replacing fossil fuels. That requires a new transmission grid."
,,,"Go n stop them let me see. You call the boring ish gist, what did I get from their gist? Abeg Yvonne n olivia carry go jare. Tell us what we don't see, if you want to watch climate change or global warming go to Nat geo wild n co"
,,,What I've done is point out that there is scientific consensus about human-caused global warming by providing a few reputable sources.What you did was call out the fact that not a single scientific organization anywhere in the world disputes this!
,,,Paleezzze. I remember being told in school back in the s how we were going into global cooling then global warming. it just seems like they can't get the climate to agree with them so now it's climate change. Follow the money .. Al Gore's net worth is now $M
,,,Climate change has always happened before we were here and after we are gone global warming on the other hand hasnt actually changed/got worse for over years now thats why they changed the definition to keep pushing on with there plans to enslave under the guise of it
,,,"Despite the fact that evidence continues to mount that human activities cause global warming, this study found a growth In climate denial activity on social media since ."
,,,Climate change always happens always has always will sitting in a middle of a road ain't going to change it is it? Try hunting out the global warming news clips from s s s s so on and so on the UK is a blip on climate change.
,,,"A great article in on a study on TLDR: very hard challenge, every day becomes harder."
,,,"Climate? Why not call it global warming anymore? When the science needs rebranding, maybe its more politics than science."
,,,"The links between global warming and the health and human services sector are strong, and we must work intentionally in pursuit of climate justice in the months and years ahead."
,,,"We need to stop scaring kids about global warming.Climate change is a problem, but not a meteor hurtling toward Earth to destroy humanity."
,,,"No, I mean if the polluting industry had worked to address its pollution decades ago we would not be having those problems today:, coulda, shoulda: Exxon didn't wanna."
,,,"Such naivety over climate change. Cindy should follow the money. Climate change is latest incarnation of scam which has been called many names, hole in ozone layer, global cooling, global warming, destruction of Great Barrier Reef, declining polar bears etc. why?"
,,,"Pakistan is a nation vulnerable to climate catastrophes caused by global warming, even though it is responsible for less than % of global greenhouse gas emissions. Here is why they need help to handle these disasters."
,,,"SKY NEWS ""STOOGES"" are PAID by ""Murdoch"" to ATTACK the ALP/Others, to VILIFY President Biden &amp; his ADMINISTRATION, to DENY Climate Change/Global Warming, to DEMONISE Electric Vehicles, to push for FOSSIL FUELS to foster ""Far Right Christian Cults"" &amp; to DISCREDIT China."
,,,"Wheres Gretta? We desperately need her input. I think it is either climate change (formerly global warming), or a new angle on racism."
,,,Of course hes right. This has been clear to any sober-minded intelligent person since the inception of global warming. But trying reasoning with the Taliban. The left has become the Taliban of climate religion.
,,,Tongan volcano increased the global water vapour in the atmosphere by % in days. This doesn't fit with the global warming hysteria being peddled by both main political parties and msm &amp; google do their part in suppressing any info that doesn't dog whistle climate activists
,,,"world needs to learn from tribal societys lifestyle to fight against global challenges like climate challenge, global warming and other pressing issues: PM Modi."
,,,"Plenty of arguments, like this tweet of yours, which is based on an elementary understanding of climate science?Can you explain why reducing an extremely potent GHG in our atmosphere in the short term would not limit global warming?"
,,,"""The blunt fact is that the climate doesnt care about moral responsibilities; if China does not dramatically curb its carbon emissions, it will be absolutely impossible to hold global warming below catastrophic levels."" by"
,,,"Also the east coast, who experience the climate crisis head on. With our increasingly common and devastating hurricanes, and ever warming winters. It is apparent the climate crisis is already starting."
,,,"Well I don't think I'll get an answer but all metrics of catastrophic global warming have been proved to be false. Hurricanes aren't increasing, weather climate related deaths are the lowest ever, droughts and floods are all within the weather record norm. Sea levels have been"
,,,In the s Exxon scientists knew burning fossil fuels artificially warmed Earth's climate. Their models accurately predicted the amount of global warming by . Exxon executives then embarked on paying propagandists to spread climate change denial.
,,,Global warming was a thing of the past. It is now climate change.Much more vague.
,,,Man made global warming is a swindle. This documentary is years old but the science still applies.Top climate professors including from IPCC who're highly skeptical about MMGW.Watch Al Gore deliberately misinterpreting graphs of ocean temperatures
,,,"Top Russian space scientist advises sun is in a cooling cycle; earth been cooling since ; entering another mini ice age like Maunder Minimum; need to prepare for global cooling, not global warming; advises CO not causing climate change.."
,,,See IPCC predictions from . Green Party nor the IPCC will adjust their measurements to reflect reality. IPCC over estimated global warming by % (first min in Spanish then English) NO CLIMATE CRISIS
,,,"WHO are evil, there is no climate crisis, the BS propaganda just rolls off their tongues along with the UN and WEF."
,,,"He doesnt care hes just doing the masters bidding of blaming everything on Climate Change (formerly known as global warming)And he never backs up his rhetoric with data, so that kind of shows the minion he is"
,,,Translation: The globalists cant get the peons to give up their modern lives fast enough with scare tactics like global warming and climate change so they will crash the grid and individual economies to drive the masses into slavery by force.
,,,"The Great Global Warming Swindle. Our government, EU green party are all complicit in generating a new industry alternative energy because it is more profitable. The petroleum companies are running alternative energy, more profitable. No Climate Crisis"
,,,"Leaked Documents- Green Party &amp; EU tell IPCC scientists to lie about global warming and CO climate crisis. Read the article and see how they lied to us all to generate an alternative energy industry owned by Exxon Shell Chev, there is NO climate crisis"
,,,Its unarguable that man-made global warming is real and we are facing a climate emergency. It is accepted by me and the Crown Prosecution Service that your views are reasonable and genuinely held. Your aims are ably and genuinely articulated and are supported by the science.
,,,"lets not lie cuz miam caused a climate change on mother lake, global warming's crazy. , meteorite, ydkwtd, taolg, and youre mine saved it from the drought"
,,,"[Analysis] &amp; : , Hot wars, closed societies. Systems of governance engaged in fight for global domination, civilization in danger of collapse due to the advance of climate change, by | Project Syndicate"
,,,Climate change as a result of global warming.
,,,"My cunning plan is to use fossil fuels because there is no ""climate crisis"". There is climate *change* but we can adapt to and master a slowly warming climate so long as we have access to the cheapest, most reliable energy.Real: Energy CrisisNot real: Climate Crisis"
